{
  "$schema": "../schema.json",
  "id": "mix",
  "name": "Mix",
  "beschreibung": "Retro-Farben im ruhigen Magazin-Aufbau: Braun, Rost, Senf, Fraunces.",
  "hell": true,
  "farben": {
    "grund": "#F4ECDC",
    "flaeche": "#FBF6EC",
    "flaeche2": "#E9DCC4",
    "rand": "#3B2A20",
    "text": "#3B2A20",
    "text_gedaempft": "#8A5A3B",
    "akzent": "#C8551F",
    "akzent_text": "#FBF6EC",
    "akzent2": "#E3A72F",
    "ok": "#2F7A4F",
    "warnung": "#E3A72F",
    "fehler": "#B23A2B",
    "info": "#5E8C8A"
  },
  "schrift": {
    "anzeige": {
      "familie": "Fraunces",
      "gewicht": 900
    },
    "text": {
      "familie": "Inter",
      "gewicht": 400
    },
    "zahlen": {
      "familie": "Fraunces",
      "gewicht": 900
    },
    "ersatz": "Georgia, serif"
  },
  "form": {
    "radius": 28,
    "radius_klein": 16,
    "rand_breite": 2,
    "schatten": "none"
  },
  "deko": {
    "hoehenlinien": true,
    "seite": "#3B2A20",
    "streifen": [
      "#C8551F",
      "#E3A72F",
      "#F4ECDC"
    ]
  }
}
